{
  "version": "http://ipuz.org/v2",
  "kind": [
    "http://ipuz.org/jigsaw#1"
  ],
  "canvas": {
    "width": 3072,
    "height": 3072
  },
  "cutArrays": [
    {
      "orientation": "horizontal",
      "paths": [
        {
          "d": "M 0.0,204.8 C 40.96 211.23 94.1 176.4 80.23 217.36 C 66.36 258.32 148.28 258.32 121.19 217.36 C 94.1 176.4 163.84 197.29 204.8 204.8 C 245.76 212.31 310.18 186.59 288.79 227.55 C 267.4 268.51 349.32 268.51 329.75 227.55 C 310.18 186.59 368.64 207.61 409.6 204.8 C 450.56 201.99 512.75 177.76 491.5 218.72 C 470.25 259.68 552.17 259.68 532.46 218.72 C 512.75 177.76 573.44 208.05 614.4 204.8 C 655.36 201.55 706.53 177.74 690.6 218.7 C 674.68 259.66 756.6 259.66 731.56 218.7 C 706.53 177.74 778.24 199.18 819.2 204.8 C 860.16 210.42 921.54 225.91 907.78 184.95 C 894.02 143.99 975.94 143.99 948.74 184.95 C 921.54 225.91 983.04 205.39 1024.0 204.8 C 1064.96 204.21 1132.3 232.55 1105.51 191.59 C 1078.72 150.63 1160.64 150.63 1146.47 191.59 C 1132.3 232.55 1187.84 207.25 1228.8 204.8 C 1269.76 202.35 1331.0 187.16 1303.48 228.12 C 1275.95 269.08 1357.87 269.08 1344.44 228.12 C 1331.0 187.16 1392.64 203.56 1433.6 204.8 C 1474.56 206.04 1543.7 227.5 1520.67 186.54 C 1497.64 145.58 1579.56 145.58 1561.63 186.54 C 1543.7 227.5 1597.44 209.41 1638.4 204.8 C 1679.36 200.19 1739.05 179.93 1717.51 220.89 C 1695.98 261.85 1777.9 261.85 1758.47 220.89 C 1739.05 179.93 1802.24 201.03 1843.2 204.8 C 1884.16 208.57 1944.14 190.63 1924.82 231.59 C 1905.5 272.55 1987.42 272.55 1965.78 231.59 C 1944.14 190.63 2007.04 198.23 2048.0 204.8 C 2088.96 211.37 2152.31 233.04 2124.2 192.08 C 2096.08 151.12 2178.0 151.12 2165.16 192.08 C 2152.31 233.04 2211.84 211.85 2252.8 204.8 C 2293.76 197.75 2355.45 223.97 2332.03 183.01 C 2308.62 142.05 2390.54 142.05 2372.99 183.01 C 2355.45 223.97 2416.64 199.78 2457.6 204.8 C 2498.56 209.82 2560.06 188.25 2540.63 229.21 C 2521.2 270.17 2603.12 270.17 2581.59 229.21 C 2560.06 188.25 2621.44 204.11 2662.4 204.8 C 2703.36 205.49 2763.39 176.54 2748.8 217.5 C 2734.21 258.46 2816.13 258.46 2789.76 217.5 C 2763.39 176.54 2826.24 205.54 2867.2 204.8 C 2908.16 204.06 2968.51 180.02 2942.26 220.98 C 2916.01 261.94 2997.93 261.94 2983.22 220.98 C 2968.51 180.02 3031.04 203.05 3072.0 204.8"
        },
        {
          "d": "M 0.0,409.6 C 40.96 404.47 103.16 389.92 76.09 430.88 C 49.02 471.84 130.94 471.84 117.05 430.88 C 103.16 389.92 163.84 410.36 204.8 409.6 C 245.76 408.84 315.06 387.66 293.95 428.62 C 272.84 469.58 354.76 469.58 334.91 428.62 C 315.06 387.66 368.64 412.47 409.6 409.6 C 450.56 406.73 518.45 431.77 491.09 390.81 C 463.74 349.85 545.66 349.85 532.05 390.81 C 518.45 431.77 573.44 407.21 614.4 409.6 C 655.36 411.99 705.87 385.87 692.72 426.83 C 679.56 467.79 761.48 467.79 733.68 426.83 C 705.87 385.87 778.24 412.88 819.2 409.6 C 860.16 406.32 919.7 383.42 904.65 424.38 C 889.61 465.34 971.53 465.34 945.61 424.38 C 919.7 383.42 983.04 408.37 1024.0 409.6 C 1064.96 410.83 1124.57 434.54 1109.62 393.58 C 1094.66 352.62 1176.58 352.62 1150.58 393.58 C 1124.57 434.54 1187.84 414.89 1228.8 409.6 C 1269.76 404.31 1322.39 381.85 1303.6 422.81 C 1284.82 463.77 1366.74 463.77 1344.56 422.81 C 1322.39 381.85 1392.64 409.16 1433.6 409.6 C 1474.56 410.04 1532.31 429.93 1513.05 388.97 C 1493.8 348.01 1575.72 348.01 1554.01 388.97 C 1532.31 429.93 1597.44 414.22 1638.4 409.6 C 1679.36 404.98 1747.84 426.02 1723.63 385.06 C 1699.41 344.1 1781.33 344.1 1764.59 385.06 C 1747.84 426.02 1802.24 406.88 1843.2 409.6 C 1884.16 412.32 1949.92 438.12 1925.43 397.16 C 1900.94 356.2 1982.86 356.2 1966.39 397.16 C 1949.92 438.12 2007.04 406.67 2048.0 409.6 C 2088.96 412.53 2152.16 393.4 2129.34 434.36 C 2106.52 475.32 2188.44 475.32 2170.3 434.36 C 2152.16 393.4 2211.84 415.54 2252.8 409.6 C 2293.76 403.66 2346.51 395.64 2331.49 436.6 C 2316.46 477.56 2398.38 477.56 2372.45 436.6 C 2346.51 395.64 2416.64 414.63 2457.6 409.6 C 2498.56 404.57 2560.03 437.79 2544.96 396.83 C 2529.88 355.87 2611.8 355.87 2585.92 396.83 C 2560.03 437.79 2621.44 403.74 2662.4 409.6 C 2703.36 415.46 2761.63 423.66 2739.29 382.7 C 2716.96 341.74 2798.88 341.74 2780.25 382.7 C 2761.63 423.66 2826.24 409.33 2867.2 409.6 C 2908.16 409.87 2967.83 397.02 2944.68 437.98 C 2921.53 478.94 3003.45 478.94 2985.64 437.98 C 2967.83 397.02 3031.04 410.7 3072.0 409.6"
        },
        {
          "d": "M 0.0,614.4 C 40.96 609.5 98.47 634.0 82.8 593.04 C 67.14 552.08 149.06 552.08 123.76 593.04 C 98.47 634.0 163.84 611.34 204.8 614.4 C 245.76 617.46 310.61 590.1 286.79 631.06 C 262.97 672.02 344.89 672.02 327.75 631.06 C 310.61 590.1 368.64 609.24 409.6 614.4 C 450.56 619.56 515.25 642.39 498.17 601.43 C 481.09 560.47 563.01 560.47 539.13 601.43 C 515.25 642.39 573.44 615.36 614.4 614.4 C 655.36 613.44 713.17 642.3 695.17 601.34 C 677.18 560.38 759.1 560.38 736.13 601.34 C 713.17 642.3 778.24 610.02 819.2 614.4 C 860.16 618.78 918.07 639.42 905.35 598.46 C 892.62 557.5 974.54 557.5 946.31 598.46 C 918.07 639.42 983.04 612.41 1024.0 614.4 C 1064.96 616.39 1124.8 588.44 1109.61 629.4 C 1094.43 670.36 1176.35 670.36 1150.57 629.4 C 1124.8 588.44 1187.84 621.9 1228.8 614.4 C 1269.76 606.9 1322.8 597.31 1303.82 638.27 C 1284.85 679.23 1366.77 679.23 1344.78 638.27 C 1322.8 597.31 1392.64 614.66 1433.6 614.4 C 1474.56 614.14 1531.1 641.91 1510.95 600.95 C 1490.8 559.99 1572.72 559.99 1551.91 600.95 C 1531.1 641.91 1597.44 611.33 1638.4 614.4 C 1679.36 617.47 1736.1 626.9 1721.25 585.94 C 1706.39 544.98 1788.31 544.98 1762.21 585.94 C 1736.1 626.9 1802.24 611.69 1843.2 614.4 C 1884.16 617.11 1949.61 640.46 1927.56 599.5 C 1905.5 558.54 1987.42 558.54 1968.52 599.5 C 1949.61 640.46 2007.04 620.56 2048.0 614.4 C 2088.96 608.24 2146.01 599.26 2123.87 640.22 C 2101.72 681.18 2183.64 681.18 2164.83 640.22 C 2146.01 599.26 2211.84 616.66 2252.8 614.4 C 2293.76 612.14 2346.08 588.77 2328.03 629.73 C 2309.98 670.69 2391.9 670.69 2368.99 629.73 C 2346.08 588.77 2416.64 618.77 2457.6 614.4 C 2498.56 610.03 2561.64 587.06 2537.21 628.02 C 2512.78 668.98 2594.7 668.98 2578.17 628.02 C 2561.64 587.06 2621.44 614.21 2662.4 614.4 C 2703.36 614.59 2770.64 593.66 2748.0 634.62 C 2725.36 675.58 2807.28 675.58 2788.96 634.62 C 2770.64 593.66 2826.24 608.0 2867.2 614.4 C 2908.16 620.8 2976.73 597.4 2956.7 638.36 C 2936.68 679.32 3018.6 679.32 2997.66 638.36 C 2976.73 597.4 3031.04 616.71 3072.0 614.4"
        },
        {
          "d": "M 0.0,819.2 C 40.96 824.76 108.61 834.54 88.14 793.58 C 67.66 752.62 149.58 752.62 129.1 793.58 C 108.61 834.54 163.84 821.72 204.8 819.2 C 245.76 816.68 307.44 838.03 284.74 797.07 C 262.03 756.11 343.95 756.11 325.7 797.07 C 307.44 838.03 368.64 818.5 409.6 819.2 C 450.56 819.9 509.86 838.54 490.7 797.58 C 471.55 756.62 553.47 756.62 531.66 797.58 C 509.86 838.54 573.44 823.61 614.4 819.2 C 655.36 814.79 714.6 794.23 701.64 835.19 C 688.67 876.15 770.59 876.15 742.6 835.19 C 714.6 794.23 778.24 823.71 819.2 819.2 C 860.16 814.69 919.14 837.17 896.33 796.21 C 873.52 755.25 955.44 755.25 937.29 796.21 C 919.14 837.17 983.04 814.39 1024.0 819.2 C 1064.96 824.01 1118.23 792.04 1100.62 833.0 C 1083.01 873.96 1164.93 873.96 1141.58 833.0 C 1118.23 792.04 1187.84 816.99 1228.8 819.2 C 1269.76 821.41 1328.51 792.24 1316.01 833.2 C 1303.52 874.16 1385.44 874.16 1356.97 833.2 C 1328.51 792.24 1392.64 815.64 1433.6 819.2 C 1474.56 822.76 1542.27 837.82 1519.83 796.86 C 1497.4 755.9 1579.32 755.9 1560.79 796.86 C 1542.27 837.82 1597.44 818.84 1638.4 819.2 C 1679.36 819.56 1735.37 801.78 1714.79 842.74 C 1694.22 883.7 1776.14 883.7 1755.75 842.74 C 1735.37 801.78 1802.24 815.67 1843.2 819.2 C 1884.16 822.73 1954.09 800.14 1930.36 841.1 C 1906.63 882.06 1988.55 882.06 1971.32 841.1 C 1954.09 800.14 2007.04 823.78 2048.0 819.2 C 2088.96 814.62 2144.63 799.8 2127.82 840.76 C 2111.02 881.72 2192.94 881.72 2168.78 840.76 C 2144.63 799.8 2211.84 814.01 2252.8 819.2 C 2293.76 824.39 2355.48 797.85 2334.31 838.81 C 2313.14 879.77 2395.06 879.77 2375.27 838.81 C 2355.48 797.85 2416.64 825.55 2457.6 819.2 C 2498.56 812.85 2550.36 831.88 2537.46 790.92 C 2524.56 749.96 2606.48 749.96 2578.42 790.92 C 2550.36 831.88 2621.44 823.9 2662.4 819.2 C 2703.36 814.5 2762.79 793.07 2744.84 834.03 C 2726.9 874.99 2808.82 874.99 2785.8 834.03 C 2762.79 793.07 2826.24 825.67 2867.2 819.2 C 2908.16 812.73 2965.67 796.93 2950.19 837.89 C 2934.7 878.85 3016.62 878.85 2991.15 837.89 C 2965.67 796.93 3031.04 821.26 3072.0 819.2"
        },
        {